{
  "schema_version": 1,
  "taxonomy_version": "taxonomy-v1",
  "field_ids": [
    "ai_engineering_role",
    "portfolio_requested",
    "seniority",
    "work_mode",
    "employment",
    "skills.python",
    "skills.javascript",
    "skills.typescript",
    "skills.go",
    "skills.rust",
    "skills.java",
    "skills.c",
    "skills.cpp",
    "skills.sql",
    "skills.pytorch",
    "skills.tensorflow",
    "skills.jax",
    "skills.llm_apis",
    "skills.agents",
    "skills.rag",
    "skills.evals",
    "skills.fine_tuning",
    "skills.mcp",
    "skills.vector_db",
    "skills.prompt_engineering",
    "skills.mlops",
    "skills.data_pipelines",
    "skills.kubernetes",
    "skills.aws",
    "skills.gcp",
    "skills.react",
    "skills.node",
    "skills.postgres",
    "skills.distributed_systems",
    "skills.security",
    "salary",
    "location_stated"
  ],
  "methods": [
    "rules",
    "jev",
    "generative",
    "dev_majority"
  ],
  "split_seed": 20261014,
  "human_labels": "unprovided",
  "evaluation_status": "not_implemented",
  "provider_execution": "disabled"
}
